smartctl 7.2 2020-12-30 r5155 [Darwin 20.3.0 arm64] (local build)
Copyright (C) 2002-20, Bruce Allen, Christian Franke, www.smartmontools.org

=== START OF INFORMATION SECTION ===
Model Number:                       APPLE SSD AP0256Q
Serial Number:                      0ba0101164b50c1c
Firmware Version:                   1161.80.
PCI Vendor/Subsystem ID:            0x106b
IEEE OUI Identifier:                0x000000
Controller ID:                      0
NVMe Version:                       <1.2
Number of Namespaces:               3
Local Time is:                      Sun Mar  7 01:19:33 2021 +0530
Firmware Updates (0x02):            1 Slot
Optional Admin Commands (0x0004):   Frmw_DL
Optional NVM Commands (0x0004):     DS_Mngmt
Maximum Data Transfer Size:         256 Pages

Supported Power States
St Op     Max   Active     Idle   RL RT WL WT  Ent_Lat  Ex_Lat
 0 +     0.00W       -        -    0  0  0  0        0       0

=== START OF SMART DATA SECTION ===
SMART overall-health self-assessment test result: PASSED

SMART/Health Information (NVMe Log 0x02)
Critical Warning:                   0x00
Temperature:                        38 Celsius
Available Spare:                    100%
Available Spare Threshold:          99%
Percentage Used:                    0%
Data Units Read:                    7,070,518 [3.62 TB]
Data Units Written:                 2,872,928 [1.47 TB]
Host Read Commands:                 119,612,995
Host Write Commands:                84,494,106
Controller Busy Time:               0
Power Cycles:                       195
Power On Hours:                     83
Unsafe Shutdowns:                   5
Media and Data Integrity Errors:    0
Error Information Log Entries:      0

Read 1 entries from Error Information Log failed: GetLogPage failed: system=0x38, sub=0x0, code=745

